{
  "$schema": "https://aegaeon.dev/spec/server-client-formal-assurance-evidence-bundle.schema.json",
  "schema_version": 1,
  "bundle_id": "server-client-assurance-preflight-2026-09-07",
  "generated_at": "2026-09-07T08:39:47Z",
  "claim_target": "server-client-formal-assurance",
  "claim_gate_path": "spec/server-client-formal-assurance-claim.current.json",
  "claim_gate_sha256": "05bb53ea0ed28b9cfa1bc5b54c1f05565ee971d8e37df956d207a1e372dfc025",
  "release_stage": "internal-preflight",
  "public_claim_ready": false,
  "dependent_gate_snapshots": [
    {
      "id": "released-client-claim",
      "path": "spec/released-client-claim.current.json",
      "status": "in_progress",
      "ready_for_activation": false,
      "notes": "Released client claim remains inactive; public server/client wording is blocked."
    },
    {
      "id": "client-claim-boundary",
      "path": "spec/client-claim-boundary.current.json",
      "status": "in_progress",
      "ready_for_activation": false,
      "notes": "Client boundary default profile is aegaeon-rs256; released claim active=False."
    },
    {
      "id": "client-claim-promotion",
      "path": "spec/client-claim-promotion.current.json",
      "status": "in_progress",
      "ready_for_activation": false,
      "notes": "Promotion policy is source-managed; hosted release evidence remains open."
    },
    {
      "id": "phase4-public-activation-preflight",
      "path": "docs/releases/evidence/phase4-claim-activation-preflight.json",
      "status": "in_progress",
      "ready_for_activation": false,
      "notes": "Phase 4 preflight is internally complete; public blockers remain."
    }
  ],
  "evidence_items": [
    {
      "id": "server-assurance-baseline",
      "status": "complete",
      "path": "docs/verification/claims/assurance-case/claim-definition.md",
      "fresh": true,
      "sha256": "8aad6f86917616b88f6986b9d3ed8c1f657f9f7a7533c13b6150535ba4e0c189",
      "notes": "Server contract documentation is available; release-specific contract closure is a separate obligation."
    },
    {
      "id": "client-rp-assurance-case",
      "status": "complete",
      "path": "docs/verification/claims/client-rp-assurance-case.md",
      "fresh": true,
      "sha256": "1abd3fbf17adddd7e57529395d5bf31a94b4630aded62e2d0e5993e909caad7f",
      "notes": "Historical client-core evidence inventory is available; it does not establish SDK contract closure."
    },
    {
      "id": "client-boundary-policy",
      "status": "complete",
      "path": "spec/client-claim-boundary.current.json",
      "fresh": true,
      "sha256": "e50c952e43fbfd6df5d5abb62f8641415f38a26c95d505979a3a280dba1c18aa",
      "notes": "Client boundary freezes promoted and compat surfaces."
    },
    {
      "id": "released-client-claim-gate",
      "status": "in_progress",
      "path": "spec/released-client-claim.current.json",
      "fresh": false,
      "sha256": null,
      "notes": "Released client claim gate is not active yet."
    },
    {
      "id": "hosted-real-provider-evidence",
      "status": "in_progress",
      "path": "docs/releases/evidence/managed-provider-evidence.md",
      "fresh": false,
      "sha256": null,
      "notes": "Hosted real-provider evidence must be fresh."
    },
    {
      "id": "admin-sdk-evidence",
      "status": "complete",
      "path": "docs/releases/evidence/phase5-pre-public-blockers.json",
      "fresh": true,
      "sha256": "8edd36d884f9eba0dbdc86454df15d8c1b059167419654a06ba818adca5afbba",
      "notes": "Fresh hosted admin SDK evidence passed without widening UI claims."
    },
    {
      "id": "publication-custody",
      "status": "in_progress",
      "path": "docs/releases/evidence/publication-org-rollout.md",
      "fresh": false,
      "sha256": null,
      "notes": "Publication custody and provenance must be complete."
    },
    {
      "id": "release-security-evidence",
      "status": "in_progress",
      "path": "docs/releases/evidence/release-security-evidence.md",
      "fresh": false,
      "sha256": null,
      "notes": "Release security archive must bind required outputs."
    },
    {
      "id": "multi-review-signoff",
      "status": "in_progress",
      "path": "docs/releases/evidence/server-client-formal-assurance-phase5-internal-bundle.json",
      "fresh": false,
      "sha256": null,
      "notes": "Internal and external reviews must approve the wording."
    },
    {
      "id": "phase5-internal-evidence-bundle",
      "status": "complete",
      "path": "docs/releases/evidence/server-client-formal-assurance-phase5-internal-bundle.json",
      "fresh": true,
      "sha256": null,
      "notes": "Self-reference to this generated preflight inventory; no review approval."
    },
    {
      "id": "pre-public-blocker-closure",
      "status": "complete",
      "path": "docs/releases/evidence/phase5-pre-public-blockers.json",
      "fresh": true,
      "sha256": "8edd36d884f9eba0dbdc86454df15d8c1b059167419654a06ba818adca5afbba",
      "notes": "Historical Phase 5 closure report is retained; it does not close the current assurance contracts."
    },
    {
      "id": "positioning-scope-update",
      "status": "complete",
      "path": "docs/product-positioning.md",
      "fresh": true,
      "sha256": "f5c591f5bf0b238c1ed464e0fb90b94d44e64958e24662ea70ce57f8a7ba1197",
      "notes": "Product positioning preserves future-gated TCB wording."
    },
    {
      "id": "sdk-assurance-contract-closure",
      "status": "blocked",
      "path": "docs/verification/claims/sdk-assurance/contract-status.md",
      "fresh": false,
      "sha256": null,
      "notes": "Complete SDK requirements, own-code proof, distributed-output correspondence and security testing under C-01 through C-20."
    },
    {
      "id": "server-assurance-contract-closure",
      "status": "blocked",
      "path": "docs/verification/claims/assurance-case/contract-status.md",
      "fresh": false,
      "sha256": null,
      "notes": "Complete server requirements, implementation/state proof, symbolic security, artifact binding and security testing under G-01 through G-18."
    },
    {
      "id": "server-sdk-composition-closure",
      "status": "blocked",
      "path": "docs/verification/claims/assurance-statement.md",
      "fresh": false,
      "sha256": null,
      "notes": "A qualified combined release record under aegaeon-assurance-statement-v1 establishes compatible interfaces, counterpart assumptions and composition evidence."
    }
  ],
  "review_passes": [
    {
      "id": "claim-wording-review",
      "scope": "claim-wording",
      "reviewer": "unassigned",
      "status": "pending",
      "evidence_uri": null
    },
    {
      "id": "formal-boundary-review",
      "scope": "formal-boundary",
      "reviewer": "unassigned",
      "status": "pending",
      "evidence_uri": null
    },
    {
      "id": "server-implementation-review",
      "scope": "server-implementation",
      "reviewer": "unassigned",
      "status": "pending",
      "evidence_uri": null
    },
    {
      "id": "sdk-adapter-review",
      "scope": "sdk-adapter",
      "reviewer": "unassigned",
      "status": "pending",
      "evidence_uri": null
    },
    {
      "id": "release-custody-review",
      "scope": "release-custody",
      "reviewer": "unassigned",
      "status": "pending",
      "evidence_uri": null
    },
    {
      "id": "external-security-review",
      "scope": "external-security",
      "reviewer": "unassigned",
      "status": "pending",
      "evidence_uri": null
    }
  ],
  "blockers": [
    "released-client-claim-activation: Activate after fresh hosted evidence and custody.",
    "fresh-managed-provider-evidence: Provision tenant config; rerun managed-provider lane.",
    "release-security-archive: Archive fresh release-candidate security evidence.",
    "release-custody-review: Approve release custody using publication-org evidence.",
    "external-security-review: Complete independent security review.",
    "public-wording-release: Publish final wording change only after gates are active.",
    "released-client-claim-gate: Released client claim gate is not active yet.",
    "hosted-real-provider-evidence: Hosted real-provider evidence must be fresh.",
    "publication-custody: Publication custody and provenance must be complete.",
    "release-security-evidence: Release security archive must bind required outputs.",
    "multi-review-signoff: Internal and external reviews must approve the wording.",
    "sdk-assurance-contract-closure: Complete SDK requirements, own-code proof, distributed-output correspondence and security testing under C-01 through C-20.",
    "server-assurance-contract-closure: Complete server requirements, implementation/state proof, symbolic security, artifact binding and security testing under G-01 through G-18.",
    "server-sdk-composition-closure: A qualified combined release record under aegaeon-assurance-statement-v1 establishes compatible interfaces, counterpart assumptions and composition evidence.",
    "Current inputs require review; generation does not issue approvals."
  ]
}
